{
  "version": "1.0",
  "title": "Parcours d'apprentissage SciBase",
  "description": "Parcours progressifs pour apprendre les sciences de l'IA via SciBase",
  "paths": [
    {
      "id": "fondamentaux-ia-ml",
      "title": "Fondamentaux de l'IA et du Machine Learning",
      "description": "Parcours complet des bases du ML jusqu'aux domaines spécialisés",
      "topics": [
        {
          "topic_id": "machine-learning",
          "level": "debutant",
          "order": 1,
          "prerequisites": []
        },
        {
          "topic_id": "deep-learning",
          "level": "debutant",
          "order": 2,
          "prerequisites": ["machine-learning"]
        },
        {
          "topic_id": "natural-language-processing",
          "level": "intermediaire",
          "order": 3,
          "prerequisites": ["deep-learning"]
        },
        {
          "topic_id": "computer-vision",
          "level": "intermediaire",
          "order": 4,
          "prerequisites": ["deep-learning"]
        },
        {
          "topic_id": "reinforcement-learning",
          "level": "intermediaire",
          "order": 5,
          "prerequisites": ["machine-learning"]
        },
        {
          "topic_id": "transfer-learning",
          "level": "intermediaire",
          "order": 6,
          "prerequisites": ["deep-learning", "machine-learning"]
        },
        {
          "topic_id": "generative-models",
          "level": "intermediaire",
          "order": 7,
          "prerequisites": ["deep-learning"]
        },
        {
          "topic_id": "graph-neural-networks",
          "level": "avance",
          "order": 8,
          "prerequisites": ["deep-learning"]
        },
        {
          "topic_id": "large-language-models",
          "level": "avance",
          "order": 9,
          "prerequisites": ["deep-learning", "natural-language-processing"]
        },
        {
          "topic_id": "vision-language-models",
          "level": "avance",
          "order": 10,
          "prerequisites": ["deep-learning", "computer-vision", "natural-language-processing"]
        },
        {
          "topic_id": "statistics",
          "level": "debutant",
          "order": 11,
          "prerequisites": []
        },
        {
          "topic_id": "mathematics-for-ai",
          "level": "debutant",
          "order": 12,
          "prerequisites": []
        },
        {
          "topic_id": "bioinformatics",
          "level": "intermediaire",
          "order": 13,
          "prerequisites": ["machine-learning"]
        }
      ]
    }
  ]
}
